{
  "$schema": "https://json-schema.org/draft/2020-12/schema",
  "type": "object",
  "required": ["items", "page", "pageSize", "totalItems"],
  "properties": {
    "items": {
      "type": "array",
      "items": { "$ref": "event.schema.json" }
    },
    "page": { "type": "integer", "minimum": 1 },
    "pageSize": { "type": "integer", "minimum": 1 },
    "totalItems": { "type": "integer", "minimum": 0 }
  }
}
