{
  "items": [
    {
      "id": "v1",
      "name": "Aurora Main Stage",
      "city": "Praha",
      "address": "Výstaviště 67, Praha 7",
      "capacity": 7000
    },
    {
      "id": "v2",
      "name": "Riverside Club Stage",
      "city": "Praha",
      "address": "Bubenské nábřeží 306, Praha 7",
      "capacity": 2200
    },
    {
      "id": "v3",
      "name": "Forum Hall",
      "city": "Praha",
      "address": "Výstaviště 170, Praha 7",
      "capacity": 1300
    }
  ],
  "page": 1,
  "pageSize": 3,
  "totalItems": 3
}
